eco,name,pgn,move,color,fen,master,lichess,white,draws,blackC38,King's Gambit Accepted: Mayet Gambit,1. e4 e5 2. f4 exf4 3. Nf3 g5 4. Bc4 Bg7 5. d4 d6 6. c3,11,white,rnbqk1nr/ppp2pbp/3p4/6p1/2BPPp2/2P2N2/PP4PP/RNBQK2R b KQkq - 0 6,,lbnroKnD,11455,987,14359
C38,King's Gambit Accepted: Philidor Gambit,1. e4 e5 2. f4 exf4 3. Nf3 g5 4. Bc4 Bg7 5. h4,9,white,rnbqk1nr/pppp1pbp/8/6p1/2B1Pp1P/5N2/PPPP2P1/RNBQK2R b KQkq - 0 5,qcY8Cvtw,vGcMkcIN,11664,943,12166
C39,King's Gambit Accepted: Allgaier Gambit,1. e4 e5 2. f4 exf4 3. Nf3 g5 4. h4 g4 5. Ng5,9,white,rnbqkbnr/pppp1p1p/8/6N1/4PppP/8/PPPP2P1/RNBQKB1R b KQkq - 1 5,eQx8kiT3,WvR2FOM8,54368,3111,45051
C39,"King's Gambit Accepted: Allgaier, Blackburne Gambit",1. e4 e5 2. f4 exf4 3. Nf3 g5 4. h4 g4 5. Ng5 h6 6. Nxf7 Kxf7 7. Nc3,13,white,rnbq1bnr/pppp1k2/7p/8/4PppP/2N5/PPPP2P1/R1BQKB1R b KQ - 1 7,eQx8kiT3,FwPo2GIS,466,20,352
C39,King's Gambit Accepted: Kieseritzky Gambit,1. e4 e5 2. f4 exf4 3. Nf3 g5 4. h4 g4 5. Ne5,9,white,rnbqkbnr/pppp1p1p/8/4N3/4PppP/8/PPPP2P1/RNBQKB1R b KQkq - 1 5,SivhQWtT,XMilSw3M,92917,6857,84328
C39,"King's Gambit Accepted: Kieseritzky Gambit, Anderssen-Cordel Gambit",1. e4 e5 2. f4 exf4 3. Nf3 g5 4. h4 g4 5. Ne5 Nf6 6. Bc4 d5 7. exd5 Bd6 8. d4 Nh5 9. Bxf4 Nxf4,18,black,rnbqk2r/ppp2p1p/3b4/3PN3/2BP1npP/8/PPP3P1/RN1QK2R w KQkq - 0 10,,FJZD3C8z,15,1,28
C39,"King's Gambit Accepted: Kieseritzky Gambit, Cotter Gambit",1. e4 e5 2. f4 exf4 3. Nf3 g5 4. h4 g4 5. Ng5 h6 6. Nxf7,11,white,rnbqkbnr/pppp1N2/7p/8/4PppP/8/PPPP2P1/RNBQKB1R b KQkq - 0 6,eQx8kiT3,WvR2FOM8,26093,1571,23259
C39,"King's Gambit Accepted: Kieseritzky Gambit, Rice Gambit",1. e4 e5 2. f4 exf4 3. Nf3 g5 4. h4 g4 5. Ne5 Nf6 6. Bc4 d5 7. exd5 Bd6 8. O-O Bxe5,16,black,rnbqk2r/ppp2p1p/5n2/3Pb3/2B2ppP/8/PPPP2P1/RNBQ1RK1 w kq - 0 9,9iEVsNoJ,C3oqvjWY,20,3,39
C39,"King's Gambit Accepted: Kieseritzky, Rice Gambit",1. e4 e5 2. f4 exf4 3. Nf3 g5 4. h4 g4 5. Ne5 Nf6 6. Bc4 d5 7. exd5 Bd6 8. O-O,15,white,rnbqk2r/ppp2p1p/3b1n2/3PN3/2B2ppP/8/PPPP2P1/RNBQ1RK1 b kq - 2 8,,eNOz02ZB,29,5,54
C39,King's Gambit Accepted: King's Knight's Gambit,1. e4 e5 2. f4 exf4 3. Nf3 g5 4. h4,7,white,rnbqkbnr/pppp1p1p/8/6p1/4Pp1P/5N2/PPPP2P1/RNBQKB1R b KQkq - 0 4,SivhQWtT,XMilSw3M,184904,12253,154310
C40,Elephant Gambit,1. e4 e5 2. Nf3 d5,4,black,rnbqkbnr/ppp2ppp/8/3pp3/4P3/5N2/PPPP1PPP/RNBQKB1R w KQkq - 0 3,tP3tbihG,pKEXJbDv,1173845,112580,1249258
C40,Elephant Gambit: Maróczy Gambit,1. e4 e5 2. Nf3 d5 3. exd5 Bd6,6,black,rnbqk1nr/ppp2ppp/3b4/3Pp3/8/5N2/PPPP1PPP/RNBQKB1R w KQkq - 1 4,,j0OT0XZy,40359,3588,43679
C40,Elephant Gambit: Paulsen Countergambit,1. e4 e5 2. Nf3 d5 3. exd5 e4,6,black,rnbqkbnr/ppp2ppp/8/3P4/4p3/5N2/PPPP1PPP/RNBQKB1R w KQkq - 0 4,tP3tbihG,pKEXJbDv,483428,46682,556259
C40,King's Pawn Game: Busch-Gass Gambit,1. e4 e5 2. Nf3 Bc5,4,black,rnbqk1nr/pppp1ppp/8/2b1p3/4P3/5N2/PPPP1PPP/RNBQKB1R w KQkq - 2 3,,UjLujKEP,834461,60327,655656
C40,"King's Pawn Game: Busch-Gass Gambit, Chiodini Gambit",1. e4 e5 2. Nf3 Bc5 3. Nxe5 Nc6,6,black,r1bqk1nr/pppp1ppp/2n5/2b1N3/4P3/8/PPPP1PPP/RNBQKB1R w KQkq - 1 4,,BYKyp7lM,13187,847,10928
C40,"King's Pawn Game: Damiano Defense, Damiano Gambit",1. e4 e5 2. Nf3 f6 3. Nxe5 fxe5 4. Qh5+ g6 5. Qxe5+ Qe7 6. Qxh8,11,white,rnb1kbnQ/ppppq2p/6p1/8/4P3/8/PPPP1PPP/RNB1KB1R b KQq - 0 6,yo2Az1l4,QE1AVCS3,6267,211,2004
C40,"King's Pawn Game: Damiano Defense, Damiano Gambit, Chigorin Gambit",1. e4 e5 2. Nf3 f6 3. Nxe5 Qe7 4. Nf3 d5,8,black,rnb1kbnr/ppp1q1pp/5p2/3p4/4P3/5N2/PPPP1PPP/RNBQKB1R w KQkq - 0 5,,nAn0XjKC,1201,134,912
C40,"King's Pawn Game: Gunderam Defense, Gunderam Gambit",1. e4 e5 2. Nf3 Qe7 3. Bc4 f5,6,black,rnb1kbnr/ppppq1pp/8/4pp2/2B1P3/5N2/PPPP1PPP/RNBQK2R w KQkq - 0 4,,WL5Q1Hic,235,13,198
C40,King's Pawn Game: Gunderam Gambit,1. e4 e5 2. Nf3 c6,4,black,rnbqkbnr/pp1p1ppp/2p5/4p3/4P3/5N2/PPPP1PPP/RNBQKB1R w KQkq - 0 3,KFXwWXhP,I7HspDCm,95258,7259,74256
C40,King's Pawn Game: La Bourdonnais Gambit,1. e4 e5 2. Nf3 Qf6 3. Bc4 Qg6 4. O-O,7,white,rnb1kbnr/pppp1ppp/6q1/4p3/2B1P3/5N2/PPPP1PPP/RNBQ1RK1 b kq - 5 4,,5urMARSX,564,30,463
C40,Latvian Gambit,1. e4 e5 2. Nf3 f5,4,black,rnbqkbnr/pppp2pp/8/4pp2/4P3/5N2/PPPP1PPP/RNBQKB1R w KQkq - 0 3,71QYgHtn,Jfan18in,709826,58787,713069
C40,Latvian Gambit Accepted: Bronstein Gambit,1. e4 e5 2. Nf3 f5 3. Nxe5 Qf6 4. d4 d6 5. Nc4 fxe4 6. Qh5+ g6 7. Qe2,13,white,rnb1kbnr/ppp4p/3p1qp1/8/2NPp3/8/PPP1QPPP/RNB1KB1R b KQkq - 1 7,,Kw1G6bT7,87,6,94
C40,Latvian Gambit: Corkscrew Countergambit,1. e4 e5 2. Nf3 f5 3. Bc4 fxe4 4. Nxe5 Nf6,8,black,rnbqkb1r/pppp2pp/5n2/4N3/2B1p3/8/PPPP1PPP/RNBQK2R w KQkq - 1 5,,7cXk1lHq,4100,231,4909
C40,Latvian Gambit: Corkscrew Gambit,1. e4 e5 2. Nf3 f5 3. Nxe5 Nf6 4. Bc4 fxe4 5. Nf7 Qe7 6. Nxh8 d5,12,black,rnb1kb1N/ppp1q1pp/5n2/3p4/2B1p3/8/PPPP1PPP/RNBQK2R w KQq - 0 7,,7cXk1lHq,2154,114,3536
C40,Latvian Gambit: Diepstraten Countergambit,1. e4 e5 2. Nf3 f5 3. c4,5,white,rnbqkbnr/pppp2pp/8/4pp2/2P1P3/5N2/PP1P1PPP/RNBQKB1R b KQkq - 0 3,,,122,11,139
C40,Latvian Gambit: Lobster Gambit,1. e4 e5 2. Nf3 f5 3. g4,5,white,rnbqkbnr/pppp2pp/8/4pp2/4P1P1/5N2/PPPP1P1P/RNBQKB1R b KQkq - 0 3,,DmUpahZP,33,2,48
C40,Latvian Gambit: Mason Countergambit,1. e4 e5 2. Nf3 f5 3. d4,5,white,rnbqkbnr/pppp2pp/8/4pp2/3PP3/5N2/PPP2PPP/RNBQKB1R b KQkq - 0 3,q89OnKSL,EAwFzjPF,57526,4727,54088
C40,"Latvian Gambit: Mayet Attack, Strautins Gambit",1. e4 e5 2. Nf3 f5 3. Bc4 b5,6,black,rnbqkbnr/p1pp2pp/8/1p2pp2/2B1P3/5N2/PPPP1PPP/RNBQK2R w KQkq - 0 4,9gxiblbT,mqSCI9oJ,300,34,333
C40,Latvian Gambit: Senechaud Gambit,1. e4 e5 2. Nf3 f5 3. b4,5,white,rnbqkbnr/pppp2pp/8/4pp2/1P2P3/5N2/P1PP1PPP/RNBQKB1R b KQkq - 0 3,,toQLusUR,3,0,4
C41,Philidor Defense: Albin-Blackburne Gambit,1. e4 e5 2. Nf3 d6 3. d4 Bg4 4. dxe5 Nd7,8,black,r2qkbnr/pppn1ppp/3p4/4P3/4P1b1/5N2/PPP2PPP/RNBQKB1R w KQkq - 1 5,8CCwicyX,LOEqM38a,18626,2055,22545
C41,Philidor Defense: Bird Gambit,1. e4 e5 2. Nf3 d6 3. d4 exd4 4. c3,7,white,rnbqkbnr/ppp2ppp/3p4/8/3pP3/2P2N2/PP3PPP/RNBQKB1R b KQkq - 0 4,pEXB5TL5,6MnqRAtx,94950,7045,65838
C41,"Philidor Defense: Lion Variation, Shirov Gambit",1. e4 e5 2. Nf3 d6 3. d4 Nd7 4. Nc3 Ngf6 5. g4,9,white,r1bqkb1r/pppn1ppp/3p1n2/4p3/3PP1P1/2N2N2/PPP2P1P/R1BQKB1R b KQkq - 0 5,QHsRYigF,bR3vvrxt,12712,1249,9524
C41,Philidor Defense: Lopez Countergambit,1. e4 e5 2. Nf3 d6 3. Bc4 f5,6,black,rnbqkbnr/ppp3pp/3p4/4pp2/2B1P3/5N2/PPPP1PPP/RNBQK2R w KQkq - 0 4,,,100945,6982,92261
C41,Philidor Defense: Morphy Gambit,1. e4 e5 2. Nf3 d6 3. d4 exd4 4. Bc4,7,white,rnbqkbnr/ppp2ppp/3p4/8/2BpP3/5N2/PPP2PPP/RNBQK2R b KQkq - 1 4,PZeDAx7I,9TO4E8z4,192387,15505,146579
C41,Philidor Defense: Philidor Countergambit,1. e4 e5 2. Nf3 d6 3. d4 f5,6,black,rnbqkbnr/ppp3pp/3p4/4pp2/3PP3/5N2/PPP2PPP/RNBQKB1R w KQkq - 0 4,ptN3buw2,5w4dFKBJ,64149,4732,56545
C41,Philidor Defense: Philidor Gambit,1. e4 e5 2. Nf3 d6 3. d4 Bd7,6,black,rn1qkbnr/pppb1ppp/3p4/4p3/3PP3/5N2/PPP2PPP/RNBQKB1R w KQkq - 1 4,,2npKY6zr,4313,273,2904
C42,"Russian Game: Classical Attack, Marshall Variation, Chinese Gambit",1. e4 e5 2. Nf3 Nf6 3. Nxe5 d6 4. Nf3 Nxe4 5. d4 d5 6. Bd3 Bd6 7. O-O O-O 8. c4 c6 9. Re1 Bg4,18,black,rn1q1rk1/pp3ppp/2pb4/3p4/2PPn1b1/3B1N2/PP3PPP/RNBQR1K1 w - - 2 10,xSKwEDBd,H29LMqvU,667,84,552
C42,Russian Game: Cochrane Gambit,1. e4 e5 2. Nf3 Nf6 3. Nxe5 d6 4. Nxf7,7,white,rnbqkb1r/ppp2Npp/3p1n2/8/4P3/8/PPPP1PPP/RNBQKB1R b KQkq - 0 4,LnGKRbex,I3nODArp,86488,7392,76893
C42,"Russian Game: Damiano Variation, Kholmov Gambit",1. e4 e5 2. Nf3 Nf6 3. Nxe5 Nxe4 4. Qe2 Qe7,8,black,rnb1kb1r/ppppqppp/8/4N3/4n3/8/PPPPQPPP/RNB1KB1R w KQkq - 2 5,Qct1QSYo,K1BJBBi0,59094,10437,65510
C42,Russian Game: Moody Gambit,1. e4 e5 2. Nf3 Nf6 3. Qe2 Nc6 4. d4,7,white,r1bqkb1r/pppp1ppp/2n2n2/4p3/3PP3/5N2/PPP1QPPP/RNB1KB1R b KQkq - 0 4,,AldTeF9l,358,40,374
C42,Russian Game: Stafford Gambit,1. e4 e5 2. Nf3 Nf6 3. Nxe5 Nc6,6,black,r1bqkb1r/pppp1ppp/2n2n2/4N3/4P3/8/PPPP1PPP/RNBQKB1R w KQkq - 1 4,YiHFyvbB,I2u2ioG3,692669,59016,684438
C42,Russian Game: Stafford Gambit,1. e4 e5 2. Nf3 Nf6 3. Nxe5 Nc6 4. Nxc6 dxc6,8,black,r1bqkb1r/ppp2ppp/2p2n2/8/4P3/8/PPPP1PPP/RNBQKB1R w KQkq - 0 5,wFXOqTj4,v8rHVCVn,567015,47889,581244
C43,Bishop's Opening: Urusov Gambit,1. e4 e5 2. Bc4 Nf6 3. d4 exd4 4. Nf3,7,white,rnbqkb1r/pppp1ppp/5n2/8/2BpP3/5N2/PPP2PPP/RNBQK2R b KQkq - 1 4,eTGxYEP2,,166054,14330,135763
C43,"Bishop's Opening: Urusov Gambit, Keidansky Gambit",1. e4 e5 2. Bc4 Nf6 3. d4 exd4 4. Nf3 Nxe4 5. Qxd4,9,white,rnbqkb1r/pppp1ppp/8/8/2BQn3/5N2/PPP2PPP/RNB1K2R b KQkq - 0 5,eTGxYEP2,aVvXD8Nw,33977,2100,23093
C43,"Russian Game: Modern Attack, Tal Gambit",1. e4 e5 2. Nf3 Nf6 3. d4 exd4 4. e5 Ne4 5. Bb5,9,white,rnbqkb1r/pppp1ppp/8/1B2P3/3pn3/5N2/PPP2PPP/RNBQK2R b KQkq - 2 5,Vof96L5J,WhVO3QkG,88,4,43
C44,Irish Gambit,1. e4 e5 2. Nf3 Nc6 3. Nxe5,5,white,r1bqkbnr/pppp1ppp/2n5/4N3/4P3/8/PPPP1PPP/RNBQKB1R b KQkq - 0 3,bgD3rk9v,wRZqSaf6,11242,907,14199
C44,King's Pawn Game: Pachman Wing Gambit,1. e4 e5 2. Nf3 Nc6 3. b4,5,white,r1bqkbnr/pppp1ppp/2n5/4p3/1P2P3/5N2/P1PP1PPP/RNBQKB1R b KQkq - 0 3,,KnJJaLBP,1351,100,1532
C44,King's Pawn Game: Schulze-Müller Gambit,1. e4 e5 2. Nf3 Nc6 3. Nxe5 Nxe5 4. d4,7,white,r1bqkbnr/pppp1ppp/8/4n3/3PP3/8/PPP2PPP/RNBQKB1R b KQkq - 0 4,bgD3rk9v,wRZqSaf6,10332,816,12017
C44,"King's Pawn Game: Tayler Opening, Basman Gambit",1. e4 e5 2. Nf3 Nc6 3. Be2 Nf6 4. d4 exd4 5. e5,9,white,r1bqkb1r/pppp1ppp/2n2n2/4P3/3p4/5N2/PPP1BPPP/RNBQK2R b KQkq - 0 5,,PeWEtaMW,399,40,391
C44,Latvian Gambit: Clam Gambit,1. e4 e5 2. Nf3 Nc6 3. d3 f5 4. exf5,7,white,r1bqkbnr/pppp2pp/2n5/4pP2/8/3P1N2/PPP2PPP/RNBQKB1R b KQkq - 0 4,CqtcEn6u,,9848,1038,13351
C44,Ponziani Opening: Caro Gambit,1. e4 e5 2. Nf3 Nc6 3. c3 d5 4. Qa4 Bd7,8,black,r2qkbnr/pppb1ppp/2n5/3pp3/Q3P3/2P2N2/PP1P1PPP/RNB1KB1R w KQkq - 2 5,OKqsr5b5,ypJ4BNEV,4911,517,5474
C44,Ponziani Opening: Neumann Gambit,1. e4 e5 2. Nf3 Nc6 3. c3 Nf6 4. Bc4,7,white,r1bqkb1r/pppp1ppp/2n2n2/4p3/2B1P3/2P2N2/PP1P1PPP/RNBQK2R b KQkq - 2 4,,Ozmd4ZvD,147032,12987,156338
C44,Ponziani Opening: Ponziani Countergambit,1. e4 e5 2. Nf3 Nc6 3. c3 f5,6,black,r1bqkbnr/pppp2pp/2n5/4pp2/4P3/2P2N2/PP1P1PPP/RNBQKB1R w KQkq - 0 4,aA2Yozp9,MsRSPUUn,25512,2388,31669
C44,"Ponziani Opening: Spanish Variation, Harrwitz Attack, Nikitin Gambit",1. e4 e5 2. Nf3 Nc6 3. c3 d5 4. Bb5 dxe4 5. Nxe5 Qd5 6. Qa4,11,white,r1b1kbnr/ppp2ppp/2n5/1B1qN3/Q3p3/2P5/PP1P1PPP/RNB1K2R b KQkq - 2 6,Sj3VV1Pu,3HqZNaDS,1524,201,1540
C44,Ponziani Opening: Vukovic Gambit,1. e4 e5 2. Nf3 Nc6 3. c3 Nf6 4. d4 Nxe4 5. d5 Bc5,10,black,r1bqk2r/pppp1ppp/2n5/2bPp3/4n3/2P2N2/PP3PPP/RNBQKB1R w KQkq - 1 6,8AqzUI9Y,DfRsTUap,6597,646,9161
C44,Scotch Game: Göring Gambit,1. e4 e5 2. Nf3 Nc6 3. d4 exd4 4. c3,7,white,r1bqkbnr/pppp1ppp/2n5/8/3pP3/2P2N2/PP3PPP/RNBQKB1R b KQkq - 0 4,jWGBdoe3,EMDdBiHC,568611,45686,420543
C44,Scotch Game: Haxo Gambit,1. e4 e5 2. Nf3 Nc6 3. d4 exd4 4. Bc4 Bc5,8,black,r1bqk1nr/pppp1ppp/2n5/2b5/2BpP3/5N2/PPP2PPP/RNBQK2R w KQkq - 2 5,MkTDL4B8,,669123,54957,526180
C44,Scotch Game: Napoleon Gambit,1. e4 e5 2. Nf3 Nc6 3. d4 Nxd4 4. Nxd4 exd4 5. Bc4,9,white,r1bqkbnr/pppp1ppp/8/8/2BpP3/8/PPP2PPP/RNBQK2R b KQkq - 1 5,,6VGJLezf,1080,79,774
C44,Scotch Game: Relfsson Gambit,1. e4 e5 2. Nf3 Nc6 3. d4 exd4 4. Bb5,7,white,r1bqkbnr/pppp1ppp/2n5/1B6/3pP3/5N2/PPP2PPP/RNBQK2R b KQkq - 1 4,wLRAstGb,,27212,2566,24664
C44,Scotch Game: Scotch Gambit,1. e4 e5 2. Nf3 Nc6 3. d4 exd4 4. Bc4,7,white,r1bqkbnr/pppp1ppp/2n5/8/2BpP3/5N2/PPP2PPP/RNBQK2R b KQkq - 1 4,jmCFOrHC,96Tjpapj,2187873,200598,1738520
C45,Scotch Game: Alekhine Gambit,1. e4 e5 2. Nf3 Nc6 3. d4 exd4 4. Nxd4 Nf6 5. e5,9,white,r1bqkb1r/pppp1ppp/2n2n2/4P3/3N4/8/PPP2PPP/RNBQKB1R b KQkq - 0 5,,WshI8RkE,2119,292,3291
C47,Four Knights Game: Halloween Gambit,1. e4 e5 2. Nf3 Nc6 3. Nc3 Nf6 4. Nxe5,7,white,r1bqkb1r/pppp1ppp/2n2n2/4N3/4P3/2N5/PPPP1PPP/R1BQKB1R b KQkq - 0 4,xGsi8M93,X22zmw0j,130788,10150,109046
C47,"Four Knights Game: Italian Variation, Noa Gambit",1. e4 e5 2. Nf3 Nc6 3. Bc4 Nf6 4. Nc3 Nxe4 5. Bxf7+,9,white,r1bqkb1r/pppp1Bpp/2n5/4p3/4n3/2N2N2/PPPP1PPP/R1BQK2R b KQkq - 0 5,,ezGLpAbu,144367,17010,210628
C47,"Four Knights Game: Scotch Variation, Belgrade Gambit",1. e4 e5 2. Nf3 Nc6 3. Nc3 Nf6 4. d4 exd4 5. Nd5,9,white,r1bqkb1r/pppp1ppp/2n2n2/3N4/3pP3/5N2/PPP2PPP/R1BQKB1R b KQkq - 1 5,Jx8U0FlD,cmAPwj9y,55463,5992,40159
C47,"Four Knights Game: Scotch Variation, Krause Gambit",1. e4 e5 2. Nf3 Nc6 3. Nc3 Nf6 4. d4 Bb4 5. Nxe5,9,white,r1bqk2r/pppp1ppp/2n2n2/4N3/1b1PP3/2N5/PPP2PPP/R1BQKB1R b KQkq - 0 5,otEMQDOD,8gmY3oDJ,11160,1533,7708
C47,"Four Knights Game: Scotch Variation, Oxford Gambit",1. e4 e5 2. Nf3 Nc6 3. Nc3 Nf6 4. d4 Bb4 5. d5 Nd4,10,black,r1bqk2r/pppp1ppp/5n2/3Pp3/1b1nP3/2N2N2/PPP2PPP/R1BQKB1R w KQkq - 1 6,,,2861,206,1472
C48,"Four Knights Game: Spanish Variation, Rubinstein Variation, Marshall Gambit",1. e4 e5 2. Nf3 Nc6 3. Nc3 Nf6 4. Bb5 Nd4 5. Ba4 Bc5 6. Nxe5 O-O,12,black,r1bq1rk1/pppp1ppp/5n2/2b1N3/B2nP3/2N5/PPPP1PPP/R1BQK2R w KQ - 1 7,chjyvZj1,,1119,95,1042
C50,Italian Game: Blackburne-Kostić Gambit,1. e4 e5 2. Nf3 Nc6 3. Bc4 Nd4,6,black,r1bqkbnr/pppp1ppp/8/4p3/2BnP3/5N2/PPPP1PPP/RNBQK2R w KQkq - 4 4,,NItPQc35,568129,49870,522346
C50,"Italian Game: Classical Variation, Albin Gambit",1. e4 e5 2. Nf3 Nc6 3. Bc4 Bc5 4. O-O Nf6 5. c3,9,white,r1bqk2r/pppp1ppp/2n2n2/2b1p3/2B1P3/2P2N2/PP1P1PPP/RNBQ1RK1 b kq - 0 5,HixRSBGx,GaXn88jE,466640,38774,396002
C50,Italian Game: Deutz Gambit,1. e4 e5 2. Nf3 Nc6 3. Bc4 Bc5 4. O-O Nf6 5. d4,9,white,r1bqk2r/pppp1ppp/2n2n2/2b1p3/2BPP3/5N2/PPP2PPP/RNBQ1RK1 b kq - 0 5,rYTMzWf6,SMf5BEgF,351094,25039,229373
C50,"Italian Game: Giuoco Pianissimo, Lucchini Gambit",1. e4 e5 2. Nf3 Nc6 3. Bc4 Bc5 4. d3 f5,8,black,r1bqk1nr/pppp2pp/2n5/2b1pp2/2B1P3/3P1N2/PPP2PPP/RNBQK2R w KQkq - 0 5,,,20701,1429,19630
C50,Italian Game: Jerome Gambit,1. e4 e5 2. Nf3 Nc6 3. Bc4 Bc5 4. Bxf7+,7,white,r1bqk1nr/pppp1Bpp/2n5/2b1p3/4P3/5N2/PPPP1PPP/RNBQK2R b KQkq - 0 4,cT38OW6n,vxEnksV3,27601,2338,31362
C50,Italian Game: Rosentreter Gambit,1. e4 e5 2. Nf3 Nc6 3. Bc4 Bc5 4. d4,7,white,r1bqk1nr/pppp1ppp/2n5/2b1p3/2BPP3/5N2/PPP2PPP/RNBQK2R b KQkq - 0 4,RW7bJPDn,yAA0QWJz,226346,18114,203608
C50,Italian Game: Rousseau Gambit,1. e4 e5 2. Nf3 Nc6 3. Bc4 f5,6,black,r1bqkbnr/pppp2pp/2n5/4pp2/2B1P3/5N2/PPPP1PPP/RNBQK2R w KQkq - 0 4,7cdv8VdN,t8OmM4Cp,243630,18467,261495
C51,Italian Game: Evans Gambit,1. e4 e5 2. Nf3 Nc6 3. Bc4 Bc5 4. b4,7,white,r1bqk1nr/pppp1ppp/2n5/2b1p3/1PB1P3/5N2/P1PP1PPP/RNBQK2R b KQkq - 0 4,oVs5EH8m,KeDpLKhO,792492,55845,680894
C51,Italian Game: Evans Gambit,1. e4 e5 2. Nf3 Nc6 3. Bc4 Bc5 4. b4 Bxb4 5. c3 Bc5 6. d4 exd4 7. O-O d6 8. cxd4 Bb6 9. Nc3 Bg4,18,black,r2qk1nr/ppp2ppp/1bnp4/8/2BPP1b1/2N2N2/P4PPP/R1BQ1RK1 w kq - 3 10,1oFJi7Ni,5DrRW10H,2846,213,2966
C51,"Italian Game: Evans Gambit, Fontaine Countergambit",1. e4 e5 2. Nf3 Nc6 3. Bc4 Bc5 4. b4 b5,8,black,r1bqk1nr/p1pp1ppp/2n5/1pb1p3/1PB1P3/5N2/P1PP1PPP/RNBQK2R w KQkq - 0 5,,NFoFTN9W,280,15,101
C51,"Italian Game: Evans Gambit, Hein Countergambit",1. e4 e5 2. Nf3 Nc6 3. Bc4 Bc5 4. b4 d5,8,black,r1bqk1nr/ppp2ppp/2n5/2bpp3/1PB1P3/5N2/P1PP1PPP/RNBQK2R w KQkq - 0 5,aEHAU7hO,tNKNdhfu,1406,166,1687
C51,"Italian Game: Evans Gambit, Mortimer-Evans Gambit",1. e4 e5 2. Nf3 Nc6 3. Bc4 Bc5 4. b4 Bxb4 5. c3 Bc5 6. d4 exd4 7. O-O d6 8. cxd4 Bb6 9. Nc3 Bg4 10. Qa4 Bd7 11. Qb3 Na5 12. Bxf7+ Kf8 13. Qc2 Kxf7,26,black,r2q2nr/pppb1kpp/1b1p4/n7/3PP3/2N2N2/P1Q2PPP/R1B2RK1 w - - 0 14,,,1,0,0
C52,Italian Game: Evans Gambit,1. e4 e5 2. Nf3 Nc6 3. Bc4 Bc5 4. b4 Bxb4 5. c3 Ba5 6. O-O d6,12,black,r1bqk1nr/ppp2ppp/2np4/b3p3/2B1P3/2P2N2/P2P1PPP/RNBQ1RK1 w kq - 0 7,z1lGhChV,kjCiVWli,16397,1264,17051
C52,"Italian Game: Evans Gambit, Leonhardt Countergambit",1. e4 e5 2. Nf3 Nc6 3. Bc4 Bc5 4. b4 Bxb4 5. c3 Ba5 6. d4 b5,12,black,r1bqk1nr/p1pp1ppp/2n5/bp2p3/2BPP3/2P2N2/P4PPP/RNBQK2R w KQkq - 0 7,OWi8LjPV,B24YRkr8,1823,283,2362
C53,"Italian Game: Classical Variation, Alexandre Gambit",1. e4 e5 2. Nf3 Nc6 3. Bc4 Bc5 4. c3 f5,8,black,r1bqk1nr/pppp2pp/2n5/2b1pp2/2B1P3/2P2N2/PP1P1PPP/RNBQK2R w KQkq - 0 5,,HzrMNcx5,6989,482,6071
C53,"Italian Game: Classical Variation, Greco Gambit",1. e4 e5 2. Nf3 Nc6 3. d4 exd4 4. Bc4 Bc5 5. c3 Nf6 6. e5 d5,12,black,r1bqk2r/ppp2ppp/2n2n2/2bpP3/2Bp4/2P2N2/PP3PPP/RNBQK2R w KQkq d6 0 7,vJNXlDGZ,XnRKMXiN,125795,17353,136059
C53,"Italian Game: Scotch Gambit, Walbrodt-Baird Gambit",1. e4 e5 2. Nf3 Nc6 3. Bc4 Bc5 4. c3 Nf6 5. d4 exd4 6. O-O,11,white,r1bqk2r/pppp1ppp/2n2n2/2b5/2BpP3/2P2N2/PP3PPP/RNBQ1RK1 b kq - 1 6,Z3QydvZL,fucyaNfV,64198,5569,48682
C55,Italian Game: Scotch Gambit,1. e4 e5 2. Nf3 Nc6 3. Bc4 Nf6 4. d4 exd4 5. O-O,9,white,r1bqkb1r/pppp1ppp/2n2n2/8/2BpP3/5N2/PPP2PPP/RNBQ1RK1 b kq - 1 5,y8waWkpE,96Tjpapj,452875,52452,391637
C56,"Italian Game: Scotch Gambit, Nakhmanson Gambit",1. e4 e5 2. Nf3 Nc6 3. Bc4 Nf6 4. d4 exd4 5. O-O Nxe4 6. Nc3,11,white,r1bqkb1r/pppp1ppp/2n5/8/2Bpn3/2N2N2/PPP2PPP/R1BQ1RK1 b kq - 1 6,quBrqMYz,,25728,3210,23090
C57,"Italian Game: Two Knights Defense, Kloss Gambit",1. e4 e5 2. Nf3 Nc6 3. Bc4 Nf6 4. Ng5 d5 5. exd5 Nb4,10,black,r1bqkb1r/ppp2ppp/5n2/3Pp1N1/1nB5/8/PPPP1PPP/RNBQK2R w KQkq - 1 6,yNqbbMv1,YEOk9e3z,2587,227,2592
C57,"Italian Game: Two Knights Defense, Ponziani-Steinitz Gambit",1. e4 e5 2. Nf3 Nc6 3. Bc4 Nf6 4. Ng5 Nxe4,8,black,r1bqkb1r/pppp1ppp/2n5/4p1N1/2B1n3/8/PPPP1PPP/RNBQK2R w KQkq - 0 5,,CzWF9iSZ,47780,3944,57761
C57,"Italian Game: Two Knights Defense, Traxler Variation, Trencianske-Teplice Gambit",1. e4 e5 2. Nf3 Nc6 3. Bc4 Nf6 4. Ng5 Bc5 5. Bxf7+ Ke7 6. d4,11,white,r1bq3r/ppppkBpp/2n2n2/2b1p1N1/3PP3/8/PPP2PPP/RNBQK2R b KQ - 0 6,,QzHULIzt,442,27,509
C57,"Italian Game: Two Knights Defense, Ulvestad Variation, Kurkin Gambit",1. e4 e5 2. Nf3 Nc6 3. Bc4 Nf6 4. Ng5 d5 5. exd5 b5 6. Bf1 h6 7. Nxf7,13,white,r1bqkb1r/p1p2Np1/2n2n1p/1p1Pp3/8/8/PPPP1PPP/RNBQKB1R b KQkq - 0 7,71KNbk3S,3YgM37gF,532,59,584
C60,"Ruy Lopez: Alapin Defense, Alapin Gambit",1. e4 e5 2. Nf3 Nc6 3. Bb5 Bb4 4. c3 Ba5 5. Bxc6 dxc6,10,black,r1bqk1nr/ppp2ppp/2p5/b3p3/4P3/2P2N2/PP1P1PPP/RNBQK2R w KQkq - 0 6,,WyBR8sA4,327,42,318
C60,Ruy Lopez: Brentano Gambit,1. e4 e5 2. Nf3 Nc6 3. Bb5 g5,6,black,r1bqkbnr/pppp1p1p/2n5/1B2p1p1/4P3/5N2/PPPP1PPP/RNBQK2R w KQkq - 0 4,,xDTNqD2t,1316,154,1210
C60,"Ruy Lopez: Cozio Defense, Tartakower Gambit",1. e4 e5 2. Nf3 Nc6 3. Bb5 g6 4. d4 exd4 5. Nxd4 Bg7 6. Be3 Nge7 7. Nc3 O-O 8. Qd2 d5,16,black,r1bq1rk1/ppp1npbp/2n3p1/1B1p4/3NP3/2N1B3/PPPQ1PPP/R3K2R w KQ - 0 9,,rlkIt9SM,230,54,248
C60,"Ruy Lopez: Fianchetto Defense, Kevitz Gambit",1. e4 e5 2. Nf3 Nc6 3. Bb5 g6 4. c3 f5,8,black,r1bqkbnr/pppp3p/2n3p1/1B2pp2/4P3/2P2N2/PP1P1PPP/RNBQK2R w KQkq - 0 5,,gyhn6tXE,158,10,178
C60,Ruy Lopez: Rotary-Albany Gambit,1. e4 e5 2. Nf3 Nc6 3. Bb5 b6,6,black,r1bqkbnr/p1pp1ppp/1pn5/1B2p3/4P3/5N2/PPPP1PPP/RNBQK2R w KQkq - 0 4,,PHRU2ecu,5194,373,3559
C60,Ruy Lopez: Spanish Countergambit,1. e4 e5 2. Nf3 Nc6 3. Bb5 d5,6,black,r1bqkbnr/ppp2ppp/2n5/1B1pp3/4P3/5N2/PPPP1PPP/RNBQK2R w KQkq - 0 4,,aa76FrwK,13639,943,8613
C60,"Ruy Lopez: Spanish Countergambit, Harding Countergambit, Fricke Gambit",1. e4 e5 2. Nf3 Nc6 3. Bb5 d5 4. Nxe5 Qg5 5. O-O,9,white,r1b1kbnr/ppp2ppp/2n5/1B1pN1q1/4P3/8/PPPP1PPP/RNBQ1RK1 b kq - 2 5,,,0,0,0
C60,"Ruy Lopez: Spanish Countergambit, Harding Gambit",1. e4 e5 2. Nf3 Nc6 3. Bb5 d5 4. Nxe5 Qg5 5. Nxc6,9,white,r1b1kbnr/ppp2ppp/2N5/1B1p2q1/4P3/8/PPPP1PPP/RNBQK2R b KQkq - 0 5,,Xw4YUtE3,127,13,119
C62,"Ruy Lopez: Steinitz Defense, Center Gambit",1. e4 e5 2. Nf3 Nc6 3. Bb5 d6 4. d4 exd4 5. O-O,9,white,r1bqkbnr/ppp2ppp/2np4/1B6/3pP3/5N2/PPP2PPP/RNBQ1RK1 b kq - 1 5,,,5979,490,3784
C64,"Ruy Lopez: Classical Variation, Cordel Gambit",1. e4 e5 2. Nf3 Nc6 3. Bb5 Bc5 4. c3 f5,8,black,r1bqk1nr/pppp2pp/2n5/1Bb1pp2/4P3/2P2N2/PP1P1PPP/RNBQK2R w KQkq - 0 5,,,8443,1041,9107
C64,"Ruy Lopez: Classical Variation, Konikowski Gambit",1. e4 e5 2. Nf3 Nc6 3. Bb5 Bc5 4. c3 d5,8,black,r1bqk1nr/ppp2ppp/2n5/1Bbpp3/4P3/2P2N2/PP1P1PPP/RNBQK2R w KQkq - 0 5,,F6eWmBQP,3021,254,2628
C64,"Ruy Lopez: Classical Variation, Spanish Wing Gambit",1. e4 e5 2. Nf3 Nc6 3. Bb5 Bc5 4. b4,7,white,r1bqk1nr/pppp1ppp/2n5/1Bb1p3/1P2P3/5N2/P1PP1PPP/RNBQK2R b KQkq - 0 4,,Zuy66cNz,4210,282,4026
C65,"Ruy Lopez: Classical Variation, Zukertort Gambit",1. e4 e5 2. Nf3 Nc6 3. Bb5 Nf6 4. O-O Bc5 5. c3,9,white,r1bqk2r/pppp1ppp/2n2n2/1Bb1p3/4P3/2P2N2/PP1P1PPP/RNBQ1RK1 b kq - 0 5,RLA6sa8K,fOYDxGzI,199017,14051,136288
C69,"Ruy Lopez: Exchange Variation, Alapin Gambit",1. e4 e5 2. Nf3 Nc6 3. Bb5 a6 4. Bxc6 dxc6 5. O-O Bg4 6. h3 h5,12,black,r2qkbnr/1pp2pp1/p1p5/4p2p/4P1b1/5N1P/PPPP1PP1/RNBQ1RK1 w kq - 0 7,DuSxya9e,,55984,7662,54652
C70,"Ruy Lopez: Morphy Defense, Norwegian Variation, Nightingale Gambit",1. e4 e5 2. Nf3 Nc6 3. Bb5 a6 4. Ba4 b5 5. Bb3 Na5 6. Bxf7+,11,white,r1bqkbnr/2pp1Bpp/p7/np2p3/4P3/5N2/PPPP1PPP/RNBQK2R b KQkq - 0 6,z4Rao1pq,,3827,236,3223
C77,"Ruy Lopez: Morphy Defense, Jaffe Gambit",1. e4 e5 2. Nf3 Nc6 3. Bb5 a6 4. Ba4 Nf6 5. c3,9,white,r1bqkb1r/1ppp1ppp/p1n2n2/4p3/B3P3/2P2N2/PP1P1PPP/RNBQK2R b KQkq - 0 5,,ZBo2G0Zp,20482,2012,20087
C78,Ruy Lopez: Central Countergambit,1. e4 e5 2. Nf3 Nc6 3. Bb5 a6 4. Ba4 Nf6 5. O-O d5,10,black,r1bqkb1r/1pp2ppp/p1n2n2/3pp3/B3P3/5N2/PPPP1PPP/RNBQ1RK1 w kq - 0 6,,JDSW21UU,1430,60,518
C80,"Ruy Lopez: Open, Harksen Gambit",1. e4 e5 2. Nf3 Nc6 3. Bb5 a6 4. Ba4 Nf6 5. O-O Nxe4 6. d4 b5 7. Bb3 d5 8. c4,15,white,r1bqkb1r/2p2ppp/p1n5/1p1pp3/2PPn3/1B3N2/PP3PPP/RNBQ1RK1 b kq - 0 8,tqnpuv1v,saleKKyl,14,2,12
C80,"Ruy Lopez: Open, Karpov Gambit",1. e4 e5 2. Nf3 Nc6 3. Bb5 a6 4. Ba4 Nf6 5. O-O Nxe4 6. d4 b5 7. Bb3 d5 8. dxe5 Be6 9. Nbd2 Nc5 10. c3 d4 11. Ng5,21,white,r2qkb1r/2p2ppp/p1n1b3/1pn1P1N1/3p4/1BP5/PP1N1PPP/R1BQ1RK1 b kq - 1 11,4cgK4iNh,hYZegsk7,257,44,243
C80,"Ruy Lopez: Open, Skipworth Gambit",1. e4 e5 2. Nf3 Nc6 3. Bb5 a6 4. Ba4 Nf6 5. O-O Nxe4 6. Re1 d5,12,black,r1bqkb1r/1pp2ppp/p1n5/3pp3/B3n3/5N2/PPPP1PPP/RNBQR1K1 w kq - 0 7,,UE8m2Bxl,5280,421,2709
C84,"Ruy Lopez: Closed, Basque Gambit",1. e4 e5 2. Nf3 Nc6 3. Bb5 a6 4. Ba4 Nf6 5. O-O Be7 6. d4 exd4 7. e5 Ne4 8. c3,15,white,r1bqk2r/1pppbppp/p1n5/4P3/B2pn3/2P2N2/PP3PPP/RNBQ1RK1 b kq - 0 8,,IGtCD5ic,233,46,279
C84,"Ruy Lopez: Closed, Center Attack, Basque Gambit",1. e4 e5 2. Nf3 Nc6 3. Bb5 a6 4. Ba4 Nf6 5. O-O Be7 6. d4 exd4 7. e5 Ne4 8. c3 dxc3,16,black,r1bqk2r/1pppbppp/p1n5/4P3/B3n3/2p2N2/PP3PPP/RNBQ1RK1 w kq - 0 9,,ldKPkAo9,191,31,248
C88,"Ruy Lopez: Closed, Alekhine Gambit",1. e4 e5 2. Nf3 Nc6 3. Bb5 a6 4. Ba4 Nf6 5. O-O Be7 6. Re1 b5 7. Bb3 d6 8. c3 Na5 9. Bc2 c5 10. d4 Qc7 11. Nbd2 O-O 12. Nf1 Bg4 13. Ne3 Bxf3 14. Qxf3,27,white,r4rk1/2q1bppp/p2p1n2/npp1p3/3PP3/2P1NQ2/PPB2PPP/R1B1R1K1 b - - 0 14,,GbURLHoq,5,2,7
D00,Blackmar-Diemer Gambit,1. d4 d5 2. e4,3,white,rnbqkbnr/ppp1pppp/8/3p4/3PP3/8/PPP2PPP/RNBQKBNR b KQkq - 0 2,TGEbeK5Q,HDZNDMN2,1299720,106934,1114106
D00,Blackmar-Diemer Gambit,1. d4 d5 2. e4 dxe4 3. Nc3 Nf6,6,black,rnbqkb1r/ppp1pppp/5n2/8/3Pp3/2N5/PPP2PPP/R1BQKBNR w KQkq - 2 4,3PEfzPuH,zC7mMwAw,600636,50891,521010
D00,"Blackmar-Diemer Gambit Accepted: Euwe Defense, Zilbermints Gambit",1. d4 d5 2. e4 dxe4 3. Nc3 Nf6 4. f3 exf3 5. Nxf3 e6 6. Bg5 Be7 7. Bd3 Nc6 8. O-O Nxd4 9. Kh1,17,white,r1bqk2r/ppp1bppp/4pn2/6B1/3n4/2NB1N2/PPP3PP/R2Q1R1K b kq - 1 9,,ubJiaO3Z,142,9,102
D00,Blackmar-Diemer Gambit Accepted: Ryder Gambit,1. d4 d5 2. e4 dxe4 3. Nc3 Nf6 4. f3 exf3 5. Qxf3,9,white,rnbqkb1r/ppp1pppp/5n2/8/3P4/2N2Q2/PPP3PP/R1B1KBNR b KQkq - 0 5,,jkts30x5,142617,10485,135486
D00,Blackmar-Diemer Gambit Declined: Brombacher Countergambit,1. d4 d5 2. e4 dxe4 3. Nc3 Nf6 4. f3 c5,8,black,rnbqkb1r/pp2pppp/5n2/2p5/3Pp3/2N2P2/PPP3PP/R1BQKBNR w KQkq - 0 5,x23kDo3K,4qw83GsD,10591,1320,11629
D00,Blackmar-Diemer Gambit Declined: Elbert Countergambit,1. d4 d5 2. e4 dxe4 3. Nc3 Nf6 4. f3 e5,8,black,rnbqkb1r/ppp2ppp/5n2/4p3/3Pp3/2N2P2/PPP3PP/R1BQKBNR w KQkq - 0 5,q4GLi5pK,PD28gZVp,11707,1270,10500
D00,Blackmar-Diemer Gambit: Blackmar Gambit,1. d4 d5 2. e4 dxe4 3. f3,5,white,rnbqkbnr/ppp1pppp/8/8/3Pp3/5P2/PPP3PP/RNBQKBNR b KQkq - 0 3,,12hgbd0U,173169,13517,157968
D00,Blackmar-Diemer Gambit: Lemberger Countergambit,1. d4 d5 2. e4 dxe4 3. Nc3 e5,6,black,rnbqkbnr/ppp2ppp/8/4p3/3Pp3/2N5/PPP2PPP/R1BQKBNR w KQkq - 0 4,pAAkOSUM,7OZOj6qH,38772,4612,41796
D00,"Blackmar-Diemer Gambit: Lemberger Countergambit, Lange Gambit",1. d4 d5 2. e4 dxe4 3. Nc3 e5 4. Nxe4,7,white,rnbqkbnr/ppp2ppp/8/4p3/3PN3/8/PPP2PPP/R1BQKBNR b KQkq - 0 4,YRt7XrzG,CjJrkNHz,6247,627,5972
D00,Blackmar-Diemer Gambit: Rasa-Studier Gambit,1. d4 d5 2. e4 dxe4 3. Nc3 Nf6 4. Be3,7,white,rnbqkb1r/ppp1pppp/5n2/8/3Pp3/2N1B3/PPP2PPP/R2QKBNR b KQkq - 3 4,,U7h3GgS4,12198,1154,13214
D00,Blackmar-Diemer Gambit: Reversed Albin Countergambit,1. d4 d5 2. e4 dxe4 3. Nc3 c5,6,black,rnbqkbnr/pp2pppp/8/2p5/3Pp3/2N5/PPP2PPP/R1BQKBNR w KQkq - 0 4,euEzyDHP,QSBrwqG8,18899,2049,17415
D00,Blackmar-Diemer Gambit: von Popiel Gambit,1. d4 d5 2. e4 dxe4 3. Nc3 Nf6 4. Bg5,7,white,rnbqkb1r/ppp1pppp/5n2/6B1/3Pp3/2N5/PPP2PPP/R2QKBNR b KQkq - 3 4,nYodDqkn,YqvsoxzZ,117616,10405,95416
D00,"Queen's Pawn Game: Accelerated London System, Steinitz Countergambit",1. d4 d5 2. Bf4 c5,4,black,rnbqkbnr/pp2pppp/8/2pp4/3P1B2/8/PPP1PPPP/RN1QKBNR w KQkq - 0 3,JwXG9PMO,AIMXrU4e,556469,67296,555530
D00,"Queen's Pawn Game: Accelerated London System, Steinitz Countergambit, Morris Countergambit",1. d4 d5 2. Bf4 c5 3. e4,5,white,rnbqkbnr/pp2pppp/8/2pp4/3PPB2/8/PPP2PPP/RN1QKBNR b KQkq - 0 3,fuWK2YG3,x8Y2hEBt,7139,748,6069
D00,"Queen's Pawn Game: Chigorin Variation, Irish Gambit",1. d4 d5 2. Nc3 c5,4,black,rnbqkbnr/pp2pppp/8/2pp4/3P4/2N5/PPP1PPPP/R1BQKBNR w KQkq - 0 3,euEzyDHP,Bcq0LEcD,74851,7224,74705
D00,"Queen's Pawn Game: Chigorin Variation, Shaviliuk Gambit",1. d4 d5 2. Nc3 e5,4,black,rnbqkbnr/ppp2ppp/8/3pp3/3P4/2N5/PPP1PPPP/R1BQKBNR w KQkq - 0 3,,y8Wse5sV,14037,1258,13936
D00,Queen's Pawn Game: Hübsch Gambit,1. d4 Nf6 2. Nc3 d5 3. e4,5,white,rnbqkb1r/ppp1pppp/5n2/3p4/3PP3/2N5/PPP2PPP/R1BQKBNR b KQkq - 0 3,BQtmv8hb,31pGmROB,236235,20642,215499
